nombre,mensaje,fecha
Pedro y Mari, Que seais muy felices!! Estamos deseando que llegue el momento!!,23/09/2025 - 19:15:29
Laura y Andrés, Muchas felicidades en esta nueva etapa. Que vuestro camino juntos esté lleno de amor y alegría!,23/09/2025 - 20:05:12  
Sofía y Carlos, Que cada día esté lleno de momentos únicos. Os queremos muchísimo!,24/09/2025 - 10:32:45  
Marta y Luis, Estamos muy emocionados por vosotros. Que la vida os regale siempre sonrisas!,24/09/2025 - 13:47:09  
Elena y Javier,"Un brindis por vuestro amor, que sea eterno y lleno de aventuras!",24/09/2025 - 13:06:57
Ana y Roberto,"Que este nuevo capítuloo esté lleno de ilusión, respeto y felicidad compartida!",24/09/2025 - 13:06:15
